# Comments start with a hashtag because of how CSV is read,"<a href=""tel:+1555-555-5555"">1.555.555.5555</a>",,,,thriv.life/LINK,"<a href=""SITE-LINK"" target=""_blank"">LIST-NAME</a>"
Familia: TQLM,,"Familia: Trans Queer Liberation Movement works to achieve the liberation of trans, queer, and gender non-conforming Latinx people.","Latinx, LGBTQ, education",,thriv.life/TQLM,https://familiatqlm.org/programs/
Family Acceptance Project,,A project helping families of various cultures understand their LGBTQ children.,"LGBTQ, education",,thriv.life/FamAP,https://familyproject.sfsu.edu/
Feed Our Vets,,An organization that provides free food assistance to veterans and their families.,"general, veteran, food",,thriv.life/FeedVets,https://feedourvets.org/
Feeding Pets of the Homeless,,A nonprofit providing pet food and emergency veterinary care to pets that belong to people experiencing houselessness.,"housing, food, pet",,,http://www.petsofthehomeless.org/
#Feelmo,,An iOS app to help understand and identify feelings and practice grounding and journaling.,"app, general, mental health",,thriv.life/Feelmo,https://www.feelmo.com/
Fighting Eating Disorders in Underrepresented Populations (formerly Trans Folx Fighting Eating Disorders),,List of trans-competent providers and support groups for transgender and gender-diverse people fighting eating disorders. Also offers training resources for healthcare providers.,"LGBTQ, mental health, disordered eating",,thriv.life/TransFolx-ED,https://fedupcollective.org/resources
Finch,,An app (Android and iOS) with an emotional support companion to make daily self care fun!,"app, general, mental health",,thriv.life/Finch,https://www.finchcare.com/
Find a Helpline,,"Directory of over 1,600 hotline services across the world.","general, hotline",interational,thriv.life/FAH,https://findahelpline.com/
Find Help,,"Search for free or reduced cost services like medical care, food, job training, and more. Formerly known as Aunt Bertha.",general,,thriv.life/FindHelp,https://www.findhelp.org
Find Treatment,,A US government website for locating treatment facilities for mental health and substance use disorders.,"health, mental health, substance use",,thriv.life/FindTreatment,https://findtreatment.gov/
Finding Help for Someone Else,,Resource guide for people who are looking for mental health help for someone else.,"mental health, education",,thriv.life/Help4Some1,https://www.mentalhealthamerica.net/im-looking-mental-health-help-someone-else
Firefox Epilepsy Blocker,,A Firefox browser extension that alters webpages to block GIFs that may induce a seizure in people with epilepsy.,"general, health, disability",,thriv.life/FFEpB,https://addons.mozilla.org/en-US/firefox/addon/epilepsy-blocker/
Fireside Project,"Call or text <a href=""tel:+1623-473-7433"">1.62.FIRESIDE (3473.7433)</a>",Psychedelic peer support line. They provide emotional support during and after psychedelic experiences. Open everyday from 11:00 am - 11:00 pm PT.,"mental health, substance use, support, hotline, non-carceral",,thriv.life/FiresideProj,https://firesideproject.org/
Fireweed Collective,,Offers free monthly support groups as well as crisis resources. Groups for: BIPOC; survivors of sexual violence; BIPOC / Latinx healing poetry; Black people leaning into media and creativity; disabled / chronically ill / neurodiverse folks; and BIPOC disabled / chronically ill / neurodiverse folks.,"Black, Latinx, disability,neurodivergence, support, non-carceral",,thriv.life/Fireweed,https://fireweedcollective.org/support-groups/
Ford Fellowship,,"A fellowship program aimed at increasing diversity at the faculty-level. Awards are at the pre-doctoral, dissertation, and post-doctoral stages.","STEMM, funding",,thriv.life/FordFellow,https://sites.nationalacademies.org/PGA/FordFellowships/index.htm
FORGE,,"FORGE has several resources for trans people. One is an extensive guide on accessing therapy, along with some other PDFs and videos. Topics include self-help, SA, health, shelter, and more.","LGBTQ, gender identity, education",,thriv.life/FORGE,https://forge-forward.org/resources/trans-communities-2/
For When You Want to Give Up Zine,,A short little non-carceral zine with some strategies for taking care of yourself during the intense escalated times where you want to die.,"mental health, coping",,,https://drive.google.com/drive/mobile/folders/1v6zH4qkHUJkq9LwbugnHzxcjK0LpzKVp
"FRIENDS, Inc. Safety Plan",,"Safety planning templates for violent incidents, abusive relationships, current residence, children, court, and more.","mental health, coping",,,https://www.friendswi.org/education/safety-plan/
FTM Surgery Guide,,Directory of surgeons and describes differences between surgical procedures for trans masculine folks.,"LGBTQ, gender identity, health, providers",,thriv.life/FTMSurgery,https://www.ftmsurgery.net/
Fucking Trans Women Zine,,A very explicit 80 page resource on sexual exploration for trans feminine people and their partners. This zine describes the practice of muffing.,"LGBTQ, gender identity, sexual health",,thriv.life/FTWZine,https://archive.org/details/fucking-trans-women-mira-bellwether-october-2010.cleaned
Gay Church,,A list of LGBTQ+ affirming churches and sermons and information about inclusive Christianity.,"LGBTQ, religion",,thriv.life/GayChurch,https://www.gaychurch.org/
Gaylesta,,"A directory for finding LGBTQ+-competent therapists, with an option to search for telehealth.","LGBTQ, mental health, providers",,thriv.life/Gaylesta,https://directory.gaylesta.org/find-a-therapist/
GenderBands,,"Annual surgery and HRT grant program for trans people with solicitations in both English and Spanish. Currently has online support gatherings for trans youth, trans people 18+, trans people 40+, and parents of trans kids.","LGBTQ, gender identity, health, aid, parent",Español,thriv.life/GenderBands,https://www.genderbands.org/
Gendered Intelligence,,"a UK based, trans-led and trans-involving charity that delivers a range of direct services, projects and activities to trans, non-binary, and gender questioning people, as well as a range of education, training and consultancy to organisations and individuals who are working to better their inclusive practices. They have online groups for adults including a waiting list support group (for those waiting on gender affirming care), over 50s Transfem group, and voice workshops.","LGBTQ, gender identity, education, support",UK,,https://genderedintelligence.co.uk/services
Genderful Podcast Discord,,"A Discord for the Genderful podcase, where diverse (nonbinary and trans+) folks discuss various topics and special interests. ","LGBTQ, gender identity, support",,thriv.life/GenderfulDisc,https://discord.com/invite/TUUQ8DD
Gender GP,,"An online health service that supports the UK trans community through HRT, counselling, and transition letters. All prices for services are clearly listed.","LGBTQ, gender identity, health",UK,thriv.life/GenderGP,https://www.gendergp.com/help-centre/gendergp-service-costs/
Get Naxolone Now,,Get Naloxone Now is an online resource to train people to respond effectively to an opioid overdose emergency. Also provides information on how to access Naxolone. ,"harm reduction, health, education",,,https://www.getnaloxonenow.org/#home
Gingerbread,,"UK charity for single parent families providing advice and support, as well as an online forum.","general, support, parent",UK,thriv.life/Gingerbread,https://www.gingerbread.org.uk/
GLAAD Media Reference Guide,,"Information for reporting on and supporting people, including LGBTQ+ terms, information on current issues, and more. Web-based version has a link to a PDF version.","LGBTQ, education",,thriv.life/GLAAD-Media,https://www.glaad.org/reference#guide
GLAAD Resource List,,"LGBTQIA+ resource list classified by various topics, including: politics, sexual orientation, gender identity, military, legal, etc.","LGBTQ, general",,thriv.life/GLAAD-Res,https://www.glaad.org/resourcelist
Glean,,"A note-taking tool that can combine slides, audio recordings, and text in one place. Offers a free, unlimited access trial, and includes pricing information in their FAQ.","disability, education",,thriv.life/Glean,https://glean.co/
Global and Regional Autism Spectrum Partnership (GRASP),,GRASP offers both virtual and regional in-person support groups for autistic and neurodivergent people. Steps for membership are outlined on their site.,"neurodivergence, support",,thriv.life/GRASP,https://grasp.org/membershipsupportgroups/
Goblin Tools,,"An app (Android and iOS) as well as a website that can break down tasks into steps using AI, for anyone who struggles with multi-step tasks or breaking down tasks. For example, you can ask Goblin Tools the steps for ""changing the sheets on your bed and choose how detailed you need the breakdown to be and Goblin Tools will return a step by step checklist of what to do, and also gives the option to break any single step down further into more detailed sub steps. The app and website are fully free. Note: level of detail is referred to as ""spiciness.""","general, app, coping, neurodivergence",,thriv.life/GoblinTools,https://goblin.tools/
<i>Good and Cheap</i> Cookbook,,A free PDF cookbook for eating well on less than $4 per day.,general,,thriv.life/GoodCheapBook,https://cookbooks.leannebrown.com/good-and-cheap.pdf
GoodRx,,"Prescription prices, coupons, and pharmacy information.",general,,thriv.life/GoodRx,https://www.goodrx.com/
Google Chrome Deadname Remover Extension,,A Google Chrome browser extension that alters webpages to mask a former name/dead name.,"LGBTQ, gender identity",,thriv.life/GC-DeadnameExt,https://chrome.google.com/webstore/detail/deadname-remover/cceilgmnkeijahkehfcgfalepihfbcag
Grad Write Slack,,"An virtual writing group for graduate students and post-doctoral students. The community also has discussions on mental health, self-care, motivation, goal setting, and accountability.","STEMM, education",,thriv.life/GradWriteSlack,https://gradwritingslack.wixsite.com/gradwriteslack
Graduate Student Funding Opportunities,,A list of fellowships maintained by Johns Hopkins and includes deadlines and eligibility.,"education, funding",,thriv.life/GradFunding,https://research.jhu.edu/rdt/funding-opportunities/graduate/
Gratitude School,,"A free site with courses on self love, creating a vision board, and the ""attitude of gratitude""","general, coping",,,https://courses.gratefulness.me/
Grief in Common,,An online community for those grieving to connect through forums. Also offers courses for managing grief.,"grief, support",,thriv.life/GIC,https://www.griefincommon.com/
GriefShare,,A directory of in-person support groups for people grieving the death of a family member or friend.,"grief, support",,thriv.life/GriefShare,https://www.griefshare.org/
Guide to Allyship,,An open-source guide to being an ally to any community.,"LGBTQ, education",,thriv.life/Guide2Allyship,https://guidetoallyship.com/
Habitica,,"A free habit-forming and productivity app (web, Android, and iOS) that gamifies tasks. Also offers paid group plans with pricing information listed on their website.","general, coping",,thriv.life/Habitica,https://habitica.com/static/home
Harm Reduction Guide to Coming off Psychiatric Drugs,,A PDF guide about reducing harm when stopping or tapering psychiatric medications.,"mental health, substance use, harm reduction",,thriv.life/HRPsychDrugs,http://www.willhall.net/files/ComingOffPsychDrugsHarmReductGuide2Edonline.pdf
Harm Reduction Works (HRW),,HRW is an alternative model to 12 step programs (non-religious) that runs groups both online and in-person with some specific groups for people with specific shared identities such as LGBTQ+ or parents. They also offer a calendar with their group meetings. ,"harm reduction, support, substance use",,,https://linktr.ee/hrw
HealGrief,,Social support network and resources for processing grief and honoring loved ones and pets.,"mental health, grief, pet",,thriv.life/HealGrief,https://healgrief.org/#
Healing-Centered Resources for Those Impacted by Violence in Palestine/Israel,,A Google Doc resources list with support groups and resistance networks.,"mental health, support",,,https://tinyurl.com/resourcespi
Health Resources & Services Administration,,"A government agency that aims to help people find nearby health centers as well as provide grants, loans, and scholarships for those aspiring to work in the healthcare field.","health, funding",,thriv.life/HRSA,https://www.hrsa.gov/
Healthcare: Know Your Rights,,Information on insurance coverage and discrimination for transition-related care.,"LGBTQ, gender identity, health",,thriv.life/TE-Healthcare,https://transequality.org/know-your-rights/healthcare
Hear Me,,"A peer support 24/7/365 mobile and web-app. Membership fees are clearly marked. Subscribers can talk to ""Listeners"" anytime, for as long desired.","app, general, mental health",,,https://www.hearme.app/who-we-serve/hearme-for-individuals
Hearing Voices Coping Strategies,,"A resource with suggestions for coping with the experiences of hearing voices, and seeing visions and having tactile sensations, compiled by the Manchester Hearing Voices Group.","mental health, coping, psychosis",,thriv.life/HVCoping,https://static1.squarespace.com/static/5ebe13ab85b30366d31ce462/t/6448befe4ff9f163e953b364/1682489087146/Hearing_Voices_Coping_Strategies_web.pdf
Hearing Voices Network,,"Organization by and for people who hear voices, see visions, or have other similar experiences. The offer in-person and virtual support groups. ","mental health, support, psychosis",UK,thriv.life/HVNUK,https://www.hearing-voices.org/
Hearing Voices Network USA,,"Organization by and for people who hear voices, see visions, or have other similar experiences. The offer in-person and virtual support groups. ","mental health, support, psychosis",,thriv.life/HVNUSA,http://www.hearingvoicesusa.org/
HelpGuide,,"Evidence-based self-help articles on a variety of topics including communication, mental health, relationships, family, aging, and wellness.","general, mental health",,thriv.life/HelpGuide,https://www.helpguide.org/
Help with Bills,,Information about government programs for temporary assistance.,COVID-19,,thriv.life/Help-w-Bills,https://www.usa.gov/help-with-bills
Help with Taxes,,Information for free assistance with US tax return preparation.,general,,thriv.life/Help-w-Taxes,https://www.usa.gov/help-with-taxes
Hemingway Editor,,Website and desktop app that offers suggestions for improving language and writing and assesses the reading level of written works.,education,,thriv.life/HemingwayEditor,http://www.hemingwayapp.com/
Hero Journey Club,,"A group mental health and psychoeducation provider organization. There is a weekly cost for 90-minute sessions ($30 as of April 2023), which occur through soothing online game like Minecraft, ACNH, Stardew Valley, etc.","mental health, support",,thriv.life/HJC,https://www.herojourney.club/
HHS Formula Resources,,Information about accessing formula and alternatives during the shortage.,general,,thriv.life/Formula,https://www.hhs.gov/formula/index.html
Hidayah,,"Inclusive, secular UK-based organization supporting LGBTQI+ Muslims and promoting social justice.","LGBTQ, religion",UK,thriv.life/Hidayah,https://www.hidayahlgbt.com/
Hiki,,A dating and friendship app (Android and iOS) for autistic people.,"app, neurodivergence, relationships",,thriv.life/Hiki,https://www.hikiapp.com/
HIV Nightline Crisis Line,"<a href=""tel:+1800-628-9240"">1.800.628.9240</a>","A 24/7 hotline aimed at providing emotional support for people after testing positive, living with HIV/AIDS, or with ask questions about HIV transmission risks.","health, HIV",,thriv.life/HIVNCL,https://www.sfsuicide.org/hotlines/
HIV.gov,,"Government resource that provides HIV resources, programs and federal policies to the American public.","health, HIV",,thriv.life/HIV,https://www.hiv.gov/
Hollaback,,"A global, people-powered movement to end harassment. They have resources and help guides for intervening during and recovering from harassment on the street, online, and in the workplace.","general, coping",,thriv.life/Hollaback,https://www.ihollaback.org/resources/
Homeless Shelter Directory,,A resource to help locate local homeless shelters and service organizations.,"general, housing",,thriv.life/HomelessShelters,https://www.homelessshelterdirectory.org/
Hope Recovery,,"A Christian organization (with a strict rule against proselytizing, and separate faith-based from general programming; recognize religious / spiritual abuse), with many free support groups groups for DID, trans/enby, SA survivors, etc. They also have an intensive program for $10/day.","mental health, abuse",,,https://www.hope4-recovery.org/
How to Stay Calm During a Coronavirus Outbreak,,"Information on protecting yourself, managing anxiety, and setting realistic expectations.",COVID-19,,thriv.life/C19-StayCalm,https://www.wikihow.com/Deal-with-Coronavirus-Anxiety
How to Support Bisexual Youth,,A guide on how to support bisexual youth or young people who are attracted to more than one gender.,"LGBTQ, education",,thriv.life/SupportBiYouth,https://www.thetrevorproject.org/wp-content/uploads/2020/09/How-to-Support-Bisexual-Youth.pdf
How to Support Someone with Suicidal Thoughts,,"Thorough support information, including an instructional section toward the bottom on ""How can I help someone who is feeling suicidal?"" and resources for those in the UK.","mental health, education",UK,thriv.life/HelpSomeoneUK,https://www.rethink.org/advice-and-information/carers-hub/suicidal-thoughts-how-to-support-someone/
How to Understand Your Gender Zine,,"A short, 16-page zine and workbook on exploring gender identity.","LGBTQ, gender identity, education",,thriv.life/GenderZine,https://static1.squarespace.com/static/5e129bef7d960112ec58214f/t/5e2b88401129d962cb95ab8a/1579911235299/gender_zine.pdf
How to Use Abortion Pill,,Information on safe abortions using medication and additional abortion training and education.,"general, health, education",,thriv.life/H2UAP,https://www.howtouseabortionpill.org/
How We Feel,,"A free app (Android and iOS) on understanding emotions. It can be used to journal emotion, perform emotional check-ins, and strategize based on current feelings.","app, general, mental health",,thriv.life/HWF,https://howwefeel.org/
HRC State maps of laws and policies,,All LGBTQIA+ laws / policies broken down by state.,"LGBTQ, legal",,thriv.life/HRC-Laws,https://www.hrc.org/resources/state-scorecards/p5
HRC's LGBTQ+ Scholarship Database,,A database divided by state of scholarships for LGBTQ+ undergraduate & graduate students.,"STEMM, funding",,thriv.life/HRC-Schol,https://www.hrc.org/resources/scholarship-database
HRT Timelines,,A timeline of when certain changes may occur after starting hormone replacement therapy.,"LGBTQ, gender identity, health",,thriv.life/HRT-Timeline,https://www.gendergp.com/hrt-timelines-hormones-effects/
Human Rights Campaign,,Topical information and provides scores for states and county legal protection of LGBTQ+ individuals.,"LGBTQ, general",,thriv.life/HRC,https://www.hrc.org
Humane Society How to Cope With the Death of Your Pet,,"Explanations about the pet grief experience and what to do after a pet dies, with resources for coping.","mental health, coping, grief, pet",,,https://www.humanesociety.org/resources/how-cope-death-your-pet
I Am Sober,,A community-based app (Android and iOS) for tracking sobriety.,"app, general, mental health",,thriv.life/IAS,https://iamsober.com/
I am not Haraam,,A tumblr blog with resources and blog posts from and by LGBTQIA+ Muslims,"LGBTQ, religion",,thriv.life/NotHaraam,https://iamnotharaam.tumblr.com/
I Need An A,,Resource for finding safe abortion access in the US provided in both English and Spanish.,"general, health",Español,thriv.life/INA,https://www.ineedana.com/
IC Race Toolkits,,"English and Spanish toolkits on topics such as surviving and resisting, fear during uncertain times for mixed-immigration status families, surviving targeted social media attacks, and surviving COVID-19.","Black, coping, COVID-19",Español,thriv.life/ICRace,https://icrace.org/our-partners/toolkits/
iChill App,,A free app (Android and iOS) that teaches resiliency-building skills for healing from trauma.,"app, general, mental health",,thriv.life/iChill,http://www.ichillapp.com/index.html
I'm Muslim And My Gender Doesn't Fit Me: A Resource For Trans Muslim Youth,,A book for transgender Muslim youth about understanding gender and religious identity.,"LGBTQ, religion",,thriv.life/MuslimGender,https://advocatesforyouth.org/wp-content/uploads/2019/05/Im-Muslim-My-Gender-Doesnt-Fit-Me.pdf
I'm Still a Person Workbook,,A free PDF workbook for addressing substance use-related stigma and using appropriate language. There is a general public version and a professional education version.,"substance use, education",,,https://www.familiesagainstnarcotics.org/stigmaworkbook
ILGA Sexual Orientation Travel Maps,,World maps that highlight different legal restrictions for LGBTQ+ people.,"LGBTQ, education",,thriv.life/ILGA-Maps,https://ilga.org/maps-sexual-orientation-laws
"ILGA World- the International Lesbian, Gay, Bixexual, Trans and Intersex Assoication",,A worldwide federation that advocates for LGBT rights and provides resources on LGBT laws and issues around the world,"LGBTQ, education",,thriv.life/ILGA,https://ilga.org/
IGLTA,,The world's leading network of LGBTQ welcoming tourism businesses that provides travel resources and information.,LGBTQ,,thriv.life/IGLTA,https://www.iglta.org/
imi,,Guides built for and by LGBTQ+ teens to help explore identity and support mental health.,"under 18, LGBTQ, mental health",,thriv.life/imi,https://imi.guide/
Immigration Equality,,"An organization that advocates for immigrants and families facing discrimination based on their sexual orientation, gender identity, or HIV status. Their website has legal help information about US immigration.","LGBTQ, legal",,thriv.life/ImmEq,https://immigrationequality.org/legal/legal-help/
Immune Deficiency Foundation,,"An organization focused on improving diagnosis and treatment, as well as supporting research and education, for those living with primary immunodeficiency.","disability, education, health",,thriv.life/ImDF,https://primaryimmune.org/
Inclusive Therapists,,"Online directory of professionals that affirm all intersectional identities and strive to be anti-discrimination, anti-oppression, anti-stigma, anti-racist & anti-ableist.","LGBTQ, health, providers",,thriv.life/IncTherapists,https://www.inclusivetherapists.com/
Inclusively,,A job board that allows users to search for jobs that fit with needed accommodations.,"disability, career",,,https://www.inclusively.com/job-seekers/
Independence Science,,Access technology company with products for blind or low vision students. Their site has an interactive periodic table.,"STEMM, disability",,thriv.life/IndSci,https://independencescience.com/
Independent Peer Supporter Database,,A database via a Google Spreadsheet of information of anti-carceral independent peer support providers put together by the Radical Care Club,"non-carceral, mental health, support, providers, BIPOC",,,https://docs.google.com/spreadsheets/u/0/d/1i28oNfwZd9SDt47O7yfz7LKG3bye-EypB14ay02Ztyg/htmlview
"Information for Refugees, Asylum Seekers or Stateless People - UNHRC",,"Provided by the UNHCR, the UN Refugee Agency, it offers information for various countries in various languages for those who are refugees or seeking asylum or may be stateless people","education, general, legal",,,https://help.unhcr.org/
Indian Health Service Healthcare,,"An interactive map to find Indian Health Service, Tribal or Urban Indian Health Program¬†facilities.","LGBTQ, Indigenous",,thriv.life/IHS-Healthcare,https://www.ihs.gov/findhealthcare/
Indigenous Mutual Aid Directory,,Mutual aid groups led by Indigenous people.,"Indigenous, aid",,thriv.life/IndigMA,https://www.indigenousmutualaid.org/directory/
Indian Residential School Survivors Society,,"An organization providing essential services to Residential School Survivors, their families, and those dealing with Intergenerational traumas. They operate a 24/7 crisis line for anyone experiencing pain or distress as a result of their Residential school experience.","hotline, Indigenous",Canada,thriv.life/IRSSS,https://www.irsss.ca/
Ingersoll Gender Center Peer Support Groups,,"Free, weekly, online trans peer-led support groups with intersectional and identity-based group offerings.","LGBTQ, gender identity, support",,,https://ingersollgendercenter.org/what-we-do/support-group/
Inno Psych,,A platform for people with racially minoritized identities to find therapists of color.,"PoC, mental health, support, providers",,thriv.life/InnoPsych,https://www.innopsych.com/findatherapist
Insight Timer,,"Free meditation app (Android and iOS) for sleep, anxiety, and stress. Also has free yoga courses.","mental health, coping, app",,thriv.life/InsightTimer,https://insighttimer.com/
Integral Care,"<a href=""tel:+1512-472-4357"">512.472.HELP (4357)</a>",A 24/7 mental health hotline with crisis support. Non-crisis services 8am-5pm CT M-F except holidays,"hotline, mental health",,thriv.life/IntegralCare,https://integralcare.org/en/247-crisis-helpline/
InterACT: Advocates for Intersex Youth,,Organization that advocates for intersex youth and provides resources for intersex people.,"LGBTQ, education",,thriv.life/InterACT,https://interactadvocates.org/
