# Comments start with a hashtag because of how CSV is read,"<a href=""tel:+1555-555-5555"">1.555.555.5555</a>",,,,thriv.life/LINK,"<a href=""SITE-LINK"" target=""_blank"">LIST-NAME</a>"
Pomofocus,,An online Pomodoro timer for help getting focused on doing tasks with scheduled breaks (based on the Pomodoro technique).,general,,thriv.life/Pomofocus,https://pomofocus.io/
Poorcraft,,"A ""how to live on my own"" fundamentals book, written in the style of comic books, available in PDF for $5.",general,,,https://ironcircus.com/product/poorcraft/
Porn Addicts Anonymous,,12 step program for overcoming porn addition -- steps involve G-d.,sexual health,,thriv.life/PAdAnon,https://www.pornaddictsanonymous.org/
Postpatrum Depression Information & Resources for LGBTI+ people and Their Networks,,PDF that provides information and resources about postpartum depression in LGBTi+ people and what barriers LGBTI+ people may face receiving support,"LGBTQ, mental health, parent, providers",,,https://owh-wh-d9-prod.s3.us-east-1.amazonaws.com/s3fs-public/_images/2023/PPD/pdfs-download/23348-67_OWH24-Fact-Sheet-LGBTQ-05_ADA_submitted.pdf?utm_medium=email&utm_source=govdelivery
Postpartum Progress,,A site that provides resources and support groups for those dealing with postpartum depression and similar mental illnesses around pregnancy and early motherhood.,"mental health, gestation, parent",,thriv.life/PPProgress,https://postpartumprogress.com/
Post-Op Recovery Checklist,,"A Point of Pride article with 12 items/tips for recovery after a trans-related surgery, that also addresses post-op emotions. ","health, LGBTQ, gender identity",,,https://www.pointofpride.org/blog/post-op-recovery-checklist-12-simple-ways-make-recovery-easier
Post-Trans,,Stories from female detransitioners that icludes an international resource list page as well.,detransition,,thriv.life/DT-PostTrans,https://post-trans.com/
Prescribe It Forward,,A free mentorship program that provides pre-medical students application and guidance in order to ease the notoriously rigorous process of applying to medical school.,"STEMM, education, mentoring",,thriv.life/PrescribeIF,https://www.prescribeitforward.com/
Pride Institute,,LGBTQ+ Residential and partial hospitalization programs.,"mental health, support",,thriv.life/PrideInst,https://pride-institute.com/lgbtq-recovery-programs/
PRIDE in Practice,,LGBTQ+ health care education -- clinical articles and resources.,"LGBTQ, health",,thriv.life/PRIDE-Practice,https://www.prideinpractice.org/
PRIMED2,,A sex guide for trans men into men (explicit).,"LGBTQ, gender identity, sexual health",,thriv.life/PRIMED2,https://www.rainbowhealthontario.ca/wp-content/uploads/woocommerce_uploads/2011/02/15GMS004_primedguide-redo_vFA_booklet_ENG_web.pdf
Project Heal,,"Support to navigate the systemic, healthcare, and financial barriers that millions of people in the U.S. face when trying to heal from their eating disorder.","mental health, disordered eating",,,https://www.theprojectheal.org/
Project LETS,"Text <a href=""sms:+1.401.400.2905 &body=Hello"">401-400-2905</a>","A national grassroots organization and movement led by and for folks with lived experience of mental illness/madness, Disability, trauma, & neurodivergence. They have a number of resources on topics including crisis support, disability justice, incarceration, and homelessness. Text 401.400.2905 for urgent support with psychiatric incarceration / involuntary hospitalization, Monday-Saturday, 10:00 AM EST-4:00 PM EST.","disability, neurodivergence, mental health, support, non-carceral",,thriv.life/LETS,https://projectlets.org/
Project Rainbow Turtle,,newer mutual aid fund + network for Two-Spirit & Indigenous LGBTQIA+ folks in the United States for paying for gender affirming related costs as well as passport or name change or relocation costs as well as offering peer support or additional resources,"Indigenous, support, gender identity",,,https://projectrainbowturtle.org/
Project Return Peer Support Network (PRPSN),,"An LA-based group that offers virtual support groups accessible to anyone, with topics ranging from discussion/processing groups to activity-based groups like Yoga and Zumba to socialization groups in the community. Some groups are conducted in Spanish.","coping, mental health, support",Español,thriv.life/PRPSN,https://prpsn.org/services-peer-support-network.html?id=169
Project SHORT,,"An organization offering free mentoring for both professional health and graduate school admissions, with the goal of combatting socioeconomic and systemic inequalities in these processes.","STEMM, education, career, mentoring",,thriv.life/SHORT,https://www.project-short.com/
ProtonVPN,,"A free VPN for using the internet without surveillance. It was created for journalists and activists, and can integrate with Tor. Available on Android, iOS, Windows, Mac, and Linux.","app, general, online safety",,thriv.life/Proton,https://protonvpn.com/
Psychological Self-Help,,"A free online self-help book with topics including emotions, relationships, and changing behaviors.",mental health,,thriv.life/PSH,https://www.psychologicalselfhelp.org/
Public Neurodiversity Support Center,,"A resource hub for neurodivergent people, those questioning whether they are neurodivergent, and allies.","neurodivergence, education",,thriv.life/PNSC,https://coda.io/@mykola-bilokonsky/public-neurodiversity-support-center
QChristian,,Online forum for queer people of Christian faiths.,"LGBTQ, religion",,thriv.life/Qchristian,https://community.qchristian.org
Qmunity,,"An organization based in Vancouver, Canada that has information, referrals, and both in-person and online peer support groups.","LGBTQ, gender identity, support, parent",Canada,thriv.life/Qmunity,https://www.instagram.com/qmunity/?hl=en
QTBIPOC Eating Disorder Facebook Support Group,,"A supportive space for queer and trans Black, Indigenous, and people of color (QTBIPOC) who struggle with eating disorders (EDs).","Black, Indigenous, LGBTQ, mental health, PoC, disordered eating",,thriv.life/QTBIPOC-ED-FB,https://www.facebook.com/groups/qtbipoc.ed.support
Queer ASL,,Queer ASL focuses on introducing American Sign Language and Deaf culture to 2SLGBTQQIA+ learners and their allies. Courses are donation-only.,"LGBTQ, disability",,thriv.life/QASL,https://www.queerasl.com/
Queer Doc,,"Online, sliding scale access to HRT, gender-marker changes, PrEP, birth control, STI/STD testing, surgery, and mental health for trans individuals.","LGBTQ, mental health, health",,thriv.life/QueerDoc,https://queerdoc.com/
Queer Majority,,"An organization that produces content aimed to break down divisions, find common grounds, and bring people together to create a collaborative space where people of all backgrounds can have productive conversations. Has essays, cartoons, and poetry.","LGBTQ, coping",,thriv.life/QueerMaj,https://www.queermajority.com/
Queer Theology,,"Resources, courses, and a podcast on joining queerness and Christianity.","LGBTQ, religion",,thriv.life/QueerTheo,https://www.queertheology.com/
Queer Trans Project,,"An organization with several sub-programs: (1) “Build-a-queer kit” which are free, customized kits they arrange a few times a year (email list for restocks) for trans/gender non conforming individuals to pick out and receive gender affirming and supportive products (things like binders, trans tape, makeup, packers, nail supplies, plushies, etc) for no cost, including free shipping, (2) Free flights for transgender individuals traveling to receive gender affirming care, and (3) The QTP Loveline which is a phone number that plays pre-recorded messages of affirmations and support.","LGBTQ, gender identity, aid",,,https://queertransproject.org/
"Question, Persuade, Refer (QPR)",,Suicide prevention training for individuals and organizations.,"mental health, education",,thriv.life/QPR,https://qprinstitute.com/
## ATTN: Site having Issues RAD Remedy,,"Connect trans, gender non-conforming, intersex, and queer individuals to comprehensive care in order to improve individual and community health.","LGBTQ, gender identity",,thriv.life/RAD-Remedy,https://www.radremedy.org/
r/OCD Discord,,discord based community for those wanting community or support living with OCD,"mental health, support",,,https://discord.com/invite/qFfXeaSu23
R Voice,,"A Facebook community for academics to connect, share, support and grow.","STEMM, support",,thriv.life/Rvoice,https://www.facebook.com/groups/researchervoice/
Racial Equity Support Line,"<a href=""tel:+1503.575.3764"">1.503.575.3764</a>","A hotline that is led and staffed by people with lived experience of racism. The line is available weekdays from 10am-7pm PT (1pm-10pm ET). This is a warmline, and they will appropriately redirect people in acute crises.","hotline, Black, Indigenous, Latinx, support",,thriv.life/RESL,https://www.linesforlife.org/get-help-now/services-and-crisis-lines/racial-equity-support-line/
Racial Trauma Support Group,,"A weekly virtual support group for Black folks, that welcomes people of all identities and sizes.","Black, LGBTQ, mental health, support",,thriv.life/RacTGrp,https://www.melittlemefoundation.org/services
RAD Remedy,,"Connect trans, gender non-conforming, intersex, and queer individuals to comprehensive care in order to improve individual and community health.","LGBTQ, gender identity",,thriv.life/RadFB,https://www.facebook.com/radremedy/
Rainbow Alliance of the Deaf,,"A non-profit organization to establish and maintain a society of Def GLBT to encourange and promote their educational, economical, and social welfare.",LGBTQ,,thriv.life/DeafRAD,https://www.deafrad.org/
Rainbow Bridge,,An online support community for those grieving a pet loss. The community observes a weekly candle lighting ceremony and offers space for a virtual pet memorial.,"mental health, coping, grief, pet",,thriv.life/RainBridge,https://www.rainbowsbridge.com/hello.htm
Rainbow Railroad,,An  organization that helps LGBTQI+ people escape state-sponsored violence.,"LGBTQ, legal",international,thriv.life/RainRail,https://www.rainbowrailroad.org/
Random Acts of Kindness,,An initiative for spreading kindness with calendars of ideas and lesson plans.,general,,thriv.life/RAK,https://www.randomactsofkindness.org/
Ready for Wildfire,,"Information on preparing for a wildfire and evacuations, including how to build a ""go bag"" and make a household action plan.","general, disaster",,thriv.life/R4W,https://www.readyforwildfire.org/prepare-for-wildfire/
Recovery Dharma,,"A global nonprofit using Buddhist Practices and Principles to Recover from Addiction. Their site maintains a list of meetings, and has other resources listed.","mental health, substance use, support",,thriv.life/RecovD,https://recoverydharma.org/
Recovery Outreach Community Center,,"A trauma-informed community that offers free virtual support groups on topics including DID, eating disorders, trauma recovery, extreme states/visions, and more.","mental health, support, disordered eating",,thriv.life/ROCC,http://www.roccsalem.org/online-groups-2
Recovery Record,,"Evidenced based treatment app (Android and iOS) for eating disorders that is free for personal use. It is designed to be used as a log (feelings, thoughts, etc.) at mealtime that can be shared with a clinician via their HIPAA-compliant platform, but also includes many coping strategies for use as an individual treatment tool. Coping strategies are built on cognitive behavioral therapy techniques.","app, coping, mental health, disordered eating",,thriv.life/RecovRecApp,https://www.recoveryrecord.com/
Reflective Workbook,,Workbook for partners of trans folx.,"LGBTQ, gender identity",,thriv.life/ReflectiveWB,https://www.goodreads.com/book/show/43610689-the-reflective-workbook-for-partners-of-transgender-people
Repro Legal Helpline,"<a href=""tel:+1844.868.2812"">844.868.2812</a>","A free legal service to provide information around accessing abortion in states where it is not legal. They have a helpline and a secure online forum. They respond to all questions within 2 business days. If you are contacting them about a legal emergency (including being arrested / questioned by the police), they will contact you within 24 hours.","health, hotline, legal",,thriv.life/ReproLegal,https://www.reprolegalhelpline.org/sma-contact-the-helpline/
Research Experiences in Solid Earth Science for Students (RESESS),,"RESESS supports interns in summer research experiences at UNAVCO in Boulder, CO, as well as provides professional development opportunities and graduate school application support.","STEMM, education",,thriv.life/RESESS,https://resess.unavco.org/
Resources for POCs in STEAM,,A Google Doc with different fellowship and mentorship opportunities for people of color in STEAM fields.,"Black, Indigenous, Latinx, funding, education",,thriv.life/POC-STEAM,https://docs.google.com/spreadsheets/d/1V_pvhqWliwqLhAVcXikxAEuJPD4mwwgl9LEgOnzN-zM/edit#gid=1417047090
Riot Medicine,,"Riot Medicine includes a textbook and several quick guides about first aid and the role of a medic at protests. It is provided as information only, and reading it does not give anyone clearance to legally practice street medicine. Do not use this guide to replace contacting emergency services.","general, health, protest",,thriv.life/Rmed,https://riotmedicine.net/
Rocking Recovery Support Groups,,"Free, virtual support groups for people in recovery. Groups include a late night peer support group and a group focused on alternatives to suicide.","mental health, coping, self-harm",,thriv.life/RockRecov,http://rockingrecovery.org/zoom-meetings/
Safe Havens Mapping Project,,A searchable directory for pets of those experiencing domestic violence.,"abuse, housing, pet",,thriv.life/SafeHavens,https://safehavensforpets.org/
Safety During Protests (Amnesty USA),,An infographic about safely planning for and participating in protests.,general,,thriv.life/ProtestSafety,https://www.amnestyusa.org/pdfs/SafeyDuringProtest_F.pdf
Safer Movements Collective,,"Safer Movements Collective is a healing justice organization working to support organizers and people invested in liberation, through peer mental health support, relational skill building, and political education.","education, general, mental health",,,https://www.safermovementscollective.org/
Safety Plan Workbook-Zine,,A PDF workbook-zine for creating a safety plan and crisis toolkit.,"mental health, support",,thriv.life/SP-zine,https://drive.google.com/file/d/1DMtWcNTv0WyDl4BX5yVB1BvOp1OZQQS9/view
SAGE,"<a href=""tel:+1877.360.5428"">877.360.LGBT (5428)</a>","SAGE is the country's largest and oldest organization dedicated to improving the lives of LGBT older people. Offers a 24/7 elder hotline in English and Spanish, with translation in 180 languages.","LGBTQ, hotline",Español,thriv.life/SAGE,https://www.sageusa.org/what-we-do/sage-national-lgbt-elder-hotline/
Samaritans,"<a href=""tel:+44116-123"">44.116.123</a>","A 24/7 UK-based suicide hotline that provides services to the UK, Ireland, Scotland, and Wales.",hotline,UK,thriv.life/Samaritans,https://www.samaritans.org/
Sane in the Membrane - Palestinian Mental Health Fund (PMHF),,"PMHF offers 4-12 fully funded 1on1 therapy sessions to Palestinians in need of support. They also provide  4-6 week processing groups to grassroots organizations.  The group meets once a week for 60-90 minutes, both in person and virtual are an option.","mental health, aid",,thriv.life/PMHF,https://saneinthemembrane.com/palestinian-mh-fund
South Asian Mental Health Initiative and Network (SAMHIN),,A non-profit that aims to decrease the stigma and shame of mental health needs in the South Asian community in the US. Their website has a provider directory and information on virtual support groups.,"AAPI, mental health, support, providers",,thriv.life/SAMHIN,https://samhin.org
SAMHSA's A Practioner's Resource Guide: Helping Families to Support Their LGBT Children,,A resource guide about supporting LGBT children.,"LGBTQ, education",,thriv.life/SAMHSA-Families,https://store.samhsa.gov/sites/default/files/d7/priv/pep14-lgbtkids.pdf
SAMHSA's Disaster Distress Helpline,"<a href=""tel:+1800-985-5990"">1.800.985.5990</a> or text TalkWithUs to <a href=""sms:66746&body=TalkWithUs"">66746</a>",Substance Abuse and Mental Health Services Administration offers a 24/7 hotline to support people experiencing emotional distress related to natural or human-caused disasters.,hotline,,thriv.life/SAMHSA-Disaster,https://www.samhsa.gov/find-help/disaster-distress-helpline
SAMHSA's Indigenous Resources,,"Links to organizations, resources, and articles relating to mental health for Indigenous communities on the SAMHSA website","Indigenous, mental health, support",,,https://www.samhsa.gov/technical-assistance/tribal-ttac/resources/mental-health
SAMHSA's National Helpline,,SAMHSA offers a 24/7 hotline for treatment referral and information on mental and/or substance use disorders. Spanish also available.,"hotline, substance use",Español,thriv.life/SAMHSA,https://www.samhsa.gov/find-help/national-helpline
Schizophrenia Alliance Peer Support Groups,,"Self-help groups for people living with schizophrenia or a related condition. Many are online, and some are offered in Spanish.","mental health, support",Español,thriv.life/SA-PSG,https://sczaction.org/peer-support-groups/
Science & Engineering Leadership Initiative (SELI),,"An REU (Research Experience for Undergraduates) program for students with disabilities studying chemistry, biochemistry, or related fields, hosted at the University of Delaware.","STEMM, education, disability, career",,thriv.life/SELI,https://sites.udel.edu/seli-ud/application/
Self-Care Assessment,,An assessment of what components of self-care have been overlooked or neglected and for thinking through a plan to address them.,"mental health, coping",,thriv.life/SCAssess,https://www.brown.edu/campus-life/health/services/promotion/sites/healthpromo/files/fillable%20self-care%20worksheet.pdf
Self-Care/Collective Care Doc,,A crowdsourced Google Doc of self-care activities.,"mental health, coping",,thriv.life/ColCare,https://docs.google.com/document/d/1ffbACkUKkBvtJzTgNkYyMlCBnHVOEreBch1qYNCWFtc/edit
Self-Esteem Self-Help Resources,,A workbook and worksheets for help developing healthy self-esteem.,"mental health, coping",,thriv.life/Esteem,https://www.cci.health.wa.gov.au/Home/Resources/Looking-After-Yourself/Self-Esteem
Self-harm Distraction Techniques,,A list of potential coping/distraction techniques separated out by the motivation behind self-harm.,"mental health, self-harm",,thriv.life/SH-Distract,http://www.selfinjury.bctr.cornell.edu/perch/resources/distraction-techniques-pm-2.pdf
Self Harm Interactive Carrd,,interactive carrd focused on harm reducing with self harm as well as aftercare ,"harm reduction, education",,,https://shguide.carrd.co/
Self-help Anxiety Managment App,,An app (Android and iOS) with resources for building a person's anxiety toolkit.,"mental health, app",,thriv.life/SHAM-App,https://www.mindgarden-tech.co.uk/
Self-Help for Trauma,,Website and app (Android and iOS) with resources for using tapping to manage stressful or triggering situations.,"mental health, app",,thriv.life/SH4T,https://www.selfhelpfortrauma.org/
Self-Managed Abortion Resource Doc,,"Google Doc containing links to information/resources about self managing abortions from medical information, emotional support, legal information, funding, pill access herbs","education, health, general",,,https://docs.google.com/document/d/1rLi9cT20xDROKyjF7ceesfE2UhA9oQM92orhE9s4XNg/edit
#Sensory Strategies,,A list of different strategies and devices for sensory-seeking people.,"mental health, coping",,thriv.life/Sensory,https://raisetheflagforautism.com/sensory-strategies-for-teens-and-adults/
Sex Addicts Anonymous,,A site where people help each other stop addictive sexual behaviour as well as providing a 12 step program for overcoming sex addiction -- steps involve G-d.,sexual health,,thriv.life/SexAdAnon,https://saa-recovery.org/
"Sex, etc. (sex ed)",,"Sex education by teens, for teens.","general, sexual health",,thriv.life/SexEtc,https://sexetc.org/
Shape Math,,A technique built for people with dyslexia and dyscalculia for doing written and mental math problems. Offers a free trial and have individual and site licenses.,"disability, education",,thriv.life/ShapeMath,https://shapemath.com/
She's All Fat Resources List,,Resources for people starting a body positivity and/or fat positivity journey.,"general, health, education",,,https://shesallfatpod.com/resources
Signal App,,"A communication app with end-to-end encrypted security. Available on Android, iOS, Windows, Mac, and Linux. ","app, general, online safety",,thriv.life/Signal,https://signal.org/en/
Significant Opportunities in Atmospheric Research and Science (SOARS),,Undergraduate-to-graduate bridge program designed to broaden participation of historically underrepresented communities in the atmospheric and related sciences.,"STEMM, education",,thriv.life/SOARS,https://soars.ucar.edu/
Simply Plural App,,An app (Android and iOS) designed for plurals/systems who want to keep track of their members and optionally share those details with their friends. The app also includes functionality to vote per member on decisions within the system.,"app, coping, mental health",,thriv.life/SimplyPlural,https://play.google.com/store/apps/details?id=com.saltypandastudios.frontime
SIOS: Self-Injury Outreach and Support,,"A non-profit organization providing information and resources about self-injury to people who self-injure, have recovered, or want to help.","mental health, self-harm",,thriv.life/SIOS,http://sioutreach.org/
SIRA: Self-Injury Recovery & Awareness,,"A non-profit organization that runs peer support groups for folks looking to stop using self-injury as a way to cope. Not non-carceral, and only supports non-suicidal self-injury. Has weekly free groups, one of which is for folks 30+","self-harm, coping, support",,,https://www.thesira.org/
Siri Shortcut for Recording Police,,Information about setting up an iPhone shortcut that texts a contact alerting them you've been pulled over and starts recording using the iPhone's front-facing camera.,general,,thriv.life/Siri-Police,https://www.businessinsider.com/ios-12-shortcut-uses-iphone-to-record-police-during-traffic-stop-2018-10
Slader,,A homework help website with step-by-step solutions and a forum for asking questions.,"STEMM, education",,thriv.life/Slader,https://www.slader.com/
SMART Recovery,,Self-help program for addiction recovery.,"mental health, substance use",,thriv.life/SMART,https://www.smartrecovery.org/
Small Steps to Increase Physical Activity,,A PDF with 35 small ways to add physical activities into your regular routines.,"general, health",,thriv.life/PhysicalActivity,https://acewebcontent.azureedge.net/assets/education-resources/lifestyle/fitfacts/pdfs/fitfacts/itemid_3577.pdf
Smiling Mind App,,A free meditation and mindfulness app.,"app, coping, mental health",,thriv.life/SM-App,https://www.smilingmind.com.au/smiling-mind-app
Smoke Free,,"A government site with resources about quitting smoking and staying quit. There is support tailored for veterans, women, teens, and those 60+.","health, substance use, veteran",,thriv.life/SF,https://smokefree.gov/
Smoke Free Español,,"Spanish version of Smoke Free, a government site with resources about quitting smoking and staying quit.","health, substance use",Español,thriv.life/SFEsp,https://espanol.smokefree.gov/
Sober Black Girls Club,,"Free, weekly meetings for BIPOC in recovery (groups for Black women, BIPOC queer people, and BIPOC women). Also have a private FB group, mentorship program, and a medical fund to help support people paying for rehabilitation treatment.","Black, Indigenous, Latinx, LGBTQ, mental health, support, aid, substance use",,thriv.life/SBGC,https://soberblackgirlsclub.com/sbgcmeetings/
Sober Faction,,A peer support group that offers a Satanic approach to recovery from addiction and is free from religious dogma or superstition.,"mental health, substance use",,thriv.life/SoberFac,https://thesatanictemple.com/pages/sober-faction
Sober Recovery,,A directory of treatment facilities for people wanting to become sober. Also offers an addiction library and recovery blog.,"health, substance use, providers",,thriv.life/SoberRec,https://www.soberrecovery.com/
SPART*A,,SPART*A is a group of transgender people who currently serve or have served in the military.,"LGBTQ, gender identity, veteran",,thriv.life/SPARTA,https://spartapride.org/
Spectrum,,"A community based in Waterloo, Canada with various support groups that meet both in-person and online. Their website has a number of resources for LGBTQ+ people.","LGBTQ, gender identity, support",Canada,thriv.life/Spectrum,https://www.ourspectrum.com/spectrum-groups/
St. Louis Queer+ Support Helpline (SQSH),"<a href=""tel:+1-844-785-7774"">1.844.785.7774</a>","Free, confidential, and identity-affirming emotional support and resource referrals (warmline / helpline, not crisis line, but non-carceral / abolitionist in nature); targeted towards multiply marginalized queer people living in St. Louis, but will accept calls from anywhere in the US. Helpline hours are Friday to Monday, 2-8p ET / 11a - 5p PT","LGBTQ, gender identity, PoC, hotline, non-carceral",,thriv.life/SQSH,https://www.thesqsh.org/
Stairway to STEM,,Resources for autistic students transitioning from high school to college and enrolled in STEM courses.,"STEMM, education, disability, career",,thriv.life/Stair2STEM,https://www.stairwaytostem.org/
